Spotify ID,Title,Artist,Album,Release Date
1E01bEiTj4wngun3Nt27db,Kund Kaha Paya Vrind Kaha Hindi,Lata Mangeshkar,Shiv Kalyan Raja,2005-06-01
3ktjPZI2PfkM4Vfts9QxRa,Commentary In Hindi,Harish Bhimani,The Holy Trinity,2005-03-14
4emfV5t02YXExJ7KxSmgLH,Mahur - Hindi,Various Artists,The Land Of Fire: Music Of Azerbaijan,2005-12-20
3BDKu1hc60pDzjvi8mZSVD,Mr.Prime Minister(Hindi),Dev Anand,Mr. Prime Minister,2005-10-17
4RAf5tnp2XflbVNpnGjB9o,Mashooka Mashooka (Hindi),Sunidhi Chauhan,Mashooka,2005-05-26
3yrKU4raCXiyRVF7QK9lo8,Hindi Ko Kaya,Brownstyle,Himala Ka,2005-06-21
3SD9U10RKQd2ewT7cVTMcZ,Introduction In Hindi,Imrat Khan,Yaadein,2005-01-25
3437RGRr5ayFk6ncVeJKkw,Introduction (Hindi),Hariprasad Chaurasia,Power & Grace - 1,2005-01-25
1ofWMhP5KaPRQQK2rUjOWX,H1bees - Hindi,Kartik,H1bees,2005-11-07
1XOr1hPUsCDPBye7Ce8Mju,Sawan Geet,"Krishna Kalle, Sudha Malhotra, Pushpa Pagdhare, Dilraj Kaur",Varsha Ritu Hindi Modern Songs,2005-07-31
5kWZwgBLlI1J7IVKFY3v8G,Koyalia Ud Ja,Mukesh,Varsha Ritu Hindi Modern Songs,2005-07-31
6nqGZS6kJ5jB9vxmYn5eDF,Nach Re Mayura,Manna Dey,Varsha Ritu Hindi Modern Songs,2005-07-31
1rXWBcvzxGcXAjHnUxUwmf,Men Not Allowed (Hindi),Kalpana,Men Not Allowed,2005-05-26
1f96m8XqqNN6I2PpPIEAjC,Barsan Lagin Sawan Boondiyan,Begum Akhtar,Varsha Ritu Hindi Modern Songs,2005-07-31
4qtmaEq7l4VNcX5znGPVqj,El Hindiyeh,Salim Sarweh,Iquae Wa Rakassat Arabiya,2005-01-01
5D8FjkB0kcezrN2nL52BkG,Finale Tafta Hindi,Pat Olson,Pangia Vol 2,2005-11-30
6N18ogMI17TpiBGtsBmmKM,Janma~ Birth in Hindi,Annie Wenz/Tom Prasada-Rao,Winds of the World,2005-01-01
7uQExewkAAH5INADPoKq1t,Nibua Tale Dola,Sudha Malhotra,Varsha Ritu Hindi Modern Songs,2005-07-31
2qmmA5QSrXzLYS65FO2DHa,Hindi,Pol Edmonds,Color Wheel Cartwheel,2005-01-01
3L0BQzuW5CWkePdVkMz8kU,Biti Jat Barkha Ritu,"Lakshmi Shankar, Suman, Shakuntala, Seeta",Varsha Ritu Hindi Modern Songs,2005-07-31
30O0YDneg3Yo6mZvhdIpjs,Sawan Maas,Mubarak Begum,Varsha Ritu Hindi Modern Songs,2005-07-31
4F3DO2HIPfbUyDLr9OHfFQ,Satrang Choonar,Mahendra Kapoor,Varsha Ritu Hindi Modern Songs,2005-07-31
3MILfp3TRWDtYS2ZWy9Sw4,Barse Badra,Suman Kalyanpur,Varsha Ritu Hindi Modern Songs,2005-07-31
2OQ08tn1PsrR4AbXRPT9AS,Bakit Hindi Ako,Jamie Rivera,Kung Ako Na Lang Sana (Original Motion Picture Soundtrack),2005-12-20
1lc87bZeQmAyvGCQHdMuOw,Bakit Hindi Ako,Jamie Rivera,At Her Best,2005-09-01
5XN9ObmTrNH4XwFPHW1p00,Bakit Hindi Na Lang Ikaw,Piolo Pascual,Piolo Pascual (Platinum Hits),2005-12-01
2axgeQB9MdMxx6i2dl9E6U,Aaya Hu Maa Tere Darbar - hindi,sanjeev rajput,Aaya Hu Maa Tere Darbar (hindi),2005-08-17
57oOwdEWSV3JoegqoWyPmM,Hindi Ito Love Song,The Members,The Members,2005-09-02
792FOqxpiTc6Bsstyw8Kxa,Hoke Sher Sawar Maiya Ji Darshan Do - hindi,sanjeev rajput,Hoke Sher Sawar Maiya Ji Darshan Do (hindi),2005-08-17
6Ks9yAJwGecGXcG82lmyq0,Amrit Dharti Par Laye,Talat Mahmood,Varsha Ritu Hindi Modern Songs,2005-07-31
4QZWJcj9QXq4LvAJzy8QVJ,Keçika Hindi / Hoy Dilan - Potpori,Önder Deniz,Zû Were,2005-08-23
54JUBpWP1iSF3f2i5aIWI2,Aaya Sandesha Ambey Maa Ka Maa Ne Bulaya Hai - hindi,sanjeev rajput,Aaya Sandesha Ambey Maa Ka Maa Ne Bulaya Hai (hindi),2005-08-17
6t4Sxy1yptI98YDeSpuEwD,Maiya Ke Dar Chal Viswas Karke - hindi,sanjeev rajput,Maiya Ke Dar Chal Viswas Karke (hindi),2005-08-17
2yH5k95DxhsZhv3ifCqBRF,Hindi Magbabago,Jerome John Hughes,We Could Be in Love,2005-01-01
6Na8oJnzTpVTuZmTi9tEHp,Hindi Ko Kaya,Geneva Cruz,Best of OPM Female Hits,2005-01-01
30KOqio8m5QPexNdwQhcel,Vaisno Devi Ke Mandir Me Gunj Rahe Jaikare - hindi,sanjeev rajput,Vaisno Devi Ke Mandir Me Gunj Rahe Jaikare (hindi),2005-08-17
6K3FsFy9KOoPgcHtWT7Efz,Hındırıne Hındırıne Gula Hezex U Merdine,Koma Hezex,Buka Çiyaye Gabara,2005-08-29
5gvjarNFzz0K5ulMosXN2R,"Jo Ma Ki Jot Jagaye, Wo Maa Ke Darshan Paye - hindi",sanjeev rajput,"Jo Ma Ki Jot Jagaye, Wo Maa Ke Darshan Paye (hindi)",2005-08-17
08YRzqI2Q5FqAtQfmwZc0B,Hindi Ko Na Kayang Masaktan Pa,Karylle,You Make Me Sing,2005-01-01
4dPpmy8xiu8Mp4NsVH3ws6,Hindi kita malilimutan - Philippines,Jovie Rubio,Berceuses du monde - Lullabies Around the World,2005
1uTcqHE41Bgp7JYHHETvnT,Hindi Ko Kayang Iwan Ka,Sheryn Regis,What I Do Best,2005-07-01
7m5FmEbkytxqNdwoujTyC8,Kiss You - Hindi Breaks,"Buddha Sounds, Ahy’O",Buddha Sounds,2005
6XWW8NL19Ktfzces1FZpOe,Hindi N'yo Alam,P.O.T.,P.O.T. Remastered,2005
7rixCwRbJKNDmlR5dei8kT,Hindi Ko Kayang Iwan Ka,Sheryn Regis,Hindi Ko Kayang Iwan Ka,2005
3Mr2EYiUs76Se8EJZfdxJ9,Hindichant,sanskara dub,Another Illusion,2005-10-30
1xiogvKIocMi5wJZcTFZ9K,Hindi Ko Kayang Iwan Ka,Sheryn Regis,Hindi Ko Kayang Iwan Ka,2005-07-01
